id,keywords
0,Guess writer can boy room
1,Conference mission audience idea foreign
2,Between training listen subject
3,Look record interview few
4,Loss cell three
5,Purpose character would in
6,Hit another likely character allow pay picture
7,Power crime situation since book art red
8,Kid he weight before control board
9,Painting child reflect up control instead company
10,View central leg PM low data
11,Peace account fear shoulder pick nation choose
12,Seem sign third in approach recent program
13,Ok majority region democratic entire analysis
14,About pressure cell skill quite wife
15,Tv law fund bill third some follow
16,Majority final when new clear these
17,Finish summer else page region start size
18,Decade firm section economic
19,Employee public figure ground much
20,Analysis call upon we lose water stand
21,Could nature interest wear community college probably church
22,Place myself his itself find add sing
23,Mrs never wrong couple site
24,Sign arm bar military able simple billion
25,Now from her gun subject PM
26,Understand consumer by full parent analysis
27,Someone treatment over some collection
28,Move system certain hotel
29,Item bit leave left college listen
30,Truth ten seven both happy central group line
31,Cultural whatever computer
32,Story century attention attention hotel well news enter
33,Father growth behind probably
34,Only cup almost identify
35,Research blood list girl sister their rate
36,Nice really listen meeting
37,Condition natural can effort bad measure star
38,Eat lose various agency rich accept if
39,Involve education little direction exist
40,Once machine western month itself history the bring
41,Seven those budget involve
42,Evening his gas health sort couple station my
43,Need claim many against television former general
44,Understand relate church serve can street
45,Model similar sometimes talk remember
46,So suggest artist cold measure defense mouth
47,Camera beat activity stay
48,Unit people research fund catch without prevent ever
49,Tree especially position learn senior today mention next
50,Language provide parent information call prevent visit skin
51,Stuff section lot rather
52,Always hand game magazine series think
53,Specific show pressure
54,Raise suggest six claim analysis school
55,Strategy receive rate oil
56,Sense scientist bank result
57,Social say about century debate
58,Industry certainly Mrs
59,Wear prove lead professional kind wait
60,Prepare scene house central baby picture
61,Could own glass one then investment scientist
62,Cause trouble movie view
63,Seek of radio positive better
64,Black because song capital administration sound teach hit
65,Hotel result instead push fast
66,Everything buy protect front why
67,Fund front suggest drug
68,Truth house try thus should wide
69,Like hard industry trial position
70,Also keep kid assume dinner former
71,Person choose start
72,Couple break provide drug son show
73,Newspaper allow forward hour whom inside
74,Turn another wonder reveal
75,Account question dinner write usually team
76,Hour movement time benefit thus
77,Certainly value create agree
78,Off anything pick none
79,Ball ground candidate life have
80,Natural produce team operation point loss mean production
81,Adult range true even matter
82,Keep body lay work no
83,Say heart information part full your yeah
84,Manage each the arrive former within night want
85,Personal task same yourself front season suddenly really
86,Life ahead teach speak lay
87,Southern feel fear choose
88,Compare of Mrs
89,Something camera himself
90,Prepare blue tend house staff
91,Ago five information cut message green
92,Less physical media artist
93,Should five particular machine exist improve
94,Order attention both hour factor blue walk
95,Woman travel not identify score
96,Add pattern player personal which reflect
97,Particular network pull organization
98,Number easy hotel news film building finish
99,Environment land trouble staff follow baby job
100,Air run win change resource
101,Music item land commercial guess push support
102,Ever hospital arrive third quite beyond you out
103,Affect some various watch
104,Current by write north product well school
105,Partner son air out price interest finally
106,Whatever employee remember out some
107,Realize market walk also traditional
108,Case research approach live necessary
109,Design staff forward respond bill
110,Walk live skill course laugh
111,Degree now go energy cold right must body
112,Week key benefit coach building model entire across
113,Agent clear art international time
114,Environment list weight
115,Trade along which
116,National finish song country program prove
117,Know rich medical carry music
118,New enter message reason expect
119,Cover feel debate
120,Only word moment pretty concern
121,Once should real Mrs lay new everyone
122,Goal join reduce allow eat side
123,Why like decide
124,Peace the agency to sell positive blood home
125,Car thousand very well religious
126,Society attention heavy debate cover
127,Practice town billion painting peace half
128,Red join TV trouble you eight describe
129,Start chance southern way in movement
130,Instead smile happen successful human
131,According understand happen begin actually
132,Stock page strong term main
133,Bag season short research despite approach beautiful late
134,Heavy development nice most participant town foot
135,Brother without thus perform particular only
136,Toward claim civil inside friend service push
137,Body modern bit no
138,Bad wall conference view oil tree certainly would
139,North development everything candidate rule manager forget
140,Fly firm clear foot yard make available
141,War film Mr different admit break
142,Face fight face region go program address
143,This want change area either role type
144,Stop law you well else candidate relationship
145,Model end ball box mother
146,Figure bit data guy
147,Source discuss create policy service area
148,Light data language his few dinner
149,Social perform run firm best character strong
150,Conference least money lose ago cost outside
151,Simply finally small north follow few
152,Law international couple word
153,But city operation might
154,Training several research water behind lose deal
155,Anything mean eight campaign former budget that
156,Him child by attention among
157,Morning structure with dark art shoulder
158,Woman price yet outside now store
159,Book community commercial price set section identify cause
160,Along public join every
161,Land possible yeah recently increase music many
162,Nothing finally boy while tough reach
163,Three let poor understand
164,Off store firm perform
165,Time star political institution individual deal
166,Indicate region different leave act range live along
167,Work plant off to several test
168,Take machine them career realize past good
169,Base open scene today
170,Significant debate front free long hot
171,Hot audience machine admit culture
172,Positive record wide suddenly game
173,Throughout much nation bar
174,Brother foot administration meet
175,Growth bill during professional
176,Red list newspaper up year particular maybe
177,Clearly relate fire marriage performance
178,Opportunity fish civil
179,Collection sure simple between say statement stay performance
180,Arrive attention to nearly
181,Run what general personal town early accept nation
182,Reach leg bring accept employee box
183,Voice threat house her move a in
184,Name among hold official
185,Surface between soon decide
186,Include positive join plant ever such able
187,Sing hand industry watch allow
188,Air six think suggest state huge his
189,Science find west include environment president station
190,Glass PM since loss
191,Kid many space live measure agree guy
192,Make available tree attention agreement
193,Would professional gun describe nature often smile
194,Ahead when value point set
195,Your approach subject possible first Mr another travel
196,Issue far job edge majority behind record
197,Hope power hour court pretty
198,Number moment against purpose market east
199,Present people remember development true market
200,Understand others baby dream fall represent
201,Important social artist hot work
202,Bill both after analysis while want
203,Share maintain skill before any impact easy
204,Source project family always
205,Successful film product
206,Career professor ready politics order indeed
207,Now bill know them international
208,Meet small road wind provide quickly
209,Even investment cultural responsibility
210,Glass base reason television
211,Gas sort manage firm card
212,Half wait agreement available
213,Strong must Republican simply to miss light
214,Table condition join record
215,Fear measure south clearly country support
216,Base arm computer garden free
217,Practice happen walk think
218,Record structure one prepare organization certainly
219,Network language suffer land lot final safe pull
220,Analysis health business indeed
221,Art by will leader
222,Music others administration unit recent rise
223,Buy movement represent others
224,Pattern part which try
225,Several president yard mission suggest
226,Feeling level his create economic specific apply staff
227,Race street perform drop recent
228,All key develop suddenly music resource position
229,Accept popular line stage democratic sing
230,Policy spring moment thus bar smile
231,Cut life fear boy
232,Alone option ready trouble western car
233,Seek huge today north throughout
234,Environment decade difficult gun single
235,Feeling out Mrs nearly way great a campaign
236,Unit investment letter stop
237,Indeed within example research professional sometimes still
238,Case talk provide risk expert key many
239,Business community any eat also her cultural
240,Suggest become ever play total
241,Catch huge research item
242,Somebody minute question
243,Old plan eight ahead stock hear worry box
244,Style control cost of
245,Our for force
246,Real share computer politics nothing military fall certain
247,With election serve sea
248,Itself man off series throughout remember little
249,Reason own rich business
250,Story choice however tax
251,Do may bad important second computer cold
252,Central stage Congress soldier
253,Marriage nation way may recent
254,Debate decade table visit
255,Behind it only method rate
256,Oil its mission claim improve
257,They against song happen Congress friend green near
258,Serve since unit similar
259,Couple none community industry
260,Bed option half whose model offer those
261,Floor employee drug type million assume
262,Five idea authority position recently site bed foot
263,Factor level best yes late listen admit
264,Population fly season success foreign however
265,Value energy moment travel look
266,These technology size reflect administration adult
267,Peace certainly condition main garden
268,High about wish half watch exactly
269,Affect consider occur common group
270,Bar really stuff
271,Security add service activity travel will way
272,Many cold firm push student
273,Side course or charge trouble
274,Rather bank condition reduce
275,Would own increase
276,Identify close now yet thing century
277,Room blue media network
278,Animal skin event season quite
279,Pull thing consider region find
280,Decade remain up people
281,Some friend cold major sister
282,Shake box letter school person purpose
283,Task language at take side red
284,Mr minute although talk
285,Recently laugh same way process provide
286,Maybe read model perhaps his already
287,Fact miss left including
288,Lose health worker ready live blood some
289,Animal raise bring those push
290,There scientist let
291,Sister gas face offer administration indicate answer
292,Necessary help six
293,Development article election machine
294,Political research ground economic pay back play
295,Analysis prepare institution place support could
296,Goal nation somebody sometimes
297,Moment air director base piece mother administration
298,Second report certain possible him along
299,Leader foot your art return college country
300,Deal bad people win either bit
301,Modern go rest inside mind especially
302,Measure action because door teacher
303,East suffer child four his need give
304,Audience type play exactly those
305,Subject particularly high contain like occur become
306,Method job small much public across expert
307,Series though early tend effort college
308,Movie section us moment world hear media
309,Network today story yard good drug know
310,Region pay almost
311,Memory north clearly identify
312,Score but talk job southern where born work
313,Phone so inside especially family close relationship
314,Office culture last culture audience
315,Sell society someone economic the
316,Accept into notice fund yard
317,Against PM buy of behavior customer station
318,Toward each every fine let action nation
319,Sound no answer increase true return
320,Job manage ready of program political board
321,Guess within successful
322,Sort read security
323,Role care field keep act
324,Law require from language
325,Sense like morning talk night bank
326,Local American to country
327,Fall yes nice share fire believe
328,Movie pick man face
329,Real sense well left
330,Trial safe usually certain
331,Human toward something daughter story
332,Industry career early again mother simple
333,Item military even answer up them listen anyone
334,Certain turn budget action this radio
335,Mean form water safe certainly significant fall
336,Director sure actually
337,Apply great attorney interesting
338,Imagine goal step rest treat head
339,Buy public nice but right which
340,Least suddenly son these race
341,Occur forward decision break security a management
342,Into weight peace middle
343,Ground toward those rather gas throw
344,Its suffer manage knowledge
345,Idea week cause hospital involve home along
346,Arm financial hear performance type
347,Chair wife nor instead at
348,Also reach some
349,Behind against someone structure employee thousand
350,Protect edge authority difficult enter possible writer moment
351,Moment bill research price political popular care trouble
352,Citizen building push behind politics pull glass
353,Wind father may among
354,Business health policy community option great health
355,Country we final stage concern situation thought
356,Power statement figure record fund
357,Skill whole raise compare usually
358,Before test adult
359,Within authority conference politics support tell
360,Think technology stay general never increase perform
361,Side relate remember until
362,Put eat listen action fall class manager
363,Husband owner red have
364,General produce plan billion agreement more language
365,Action while size success
366,Entire example exactly man system kitchen
367,Game message hotel product light short fish
368,Official onto understand when require coach score
369,Free available speech middle response already computer daughter
370,City beyond no board
371,Yeah she fear speech cut but fish red
372,Future each two so television
373,Special lead he late other door
374,Join lead husband
375,Account finish when positive child pressure information
376,Cultural inside any
377,Century hair rate per so
378,Foreign rock generation wish
379,National present raise early
380,Commercial building plant apply whole rate
381,Fight onto door one hour total who
382,Woman board so trade meet
383,Loss participant four other
384,Explain enjoy deep almost medical
385,Town ahead only together
386,Business language out myself hear travel right
387,Material add southern discuss
388,Science defense majority thought
389,Face whose surface around friend
390,Drug raise herself produce now approach treatment
391,High my somebody
392,Test energy defense song majority
393,Me debate foot marriage often marriage
394,Answer let hit
395,Big contain effect close
396,Class important condition defense church old best step
397,Buy politics management police member
398,Which tonight song hot region real
399,Order however quite thus
400,Also trade environment
401,Suggest agent out require city
402,Majority make safe real
403,Field building walk road
404,Hospital figure large door
405,Color mouth north commercial wall
406,Purpose talk religious response two method
407,According situation character always family mean
408,Happen difficult understand next
409,Center baby power team American sing
410,Allow contain some
411,Read see food material wear
412,Land learn meet ball system notice
413,Money guess move process truth campaign newspaper
414,Really mean either college whether
415,Throughout long national for name reduce ability
416,Building station stand decade
417,Guy follow society father everyone now
418,Place summer position wear treatment long voice
419,Policy growth shoulder family
420,Daughter nearly federal sister
421,Chance citizen point not public within picture
422,Wish give form per poor
423,City cut like such wall
424,About couple free
425,Decide break sport culture west that book
426,Answer media him number
427,Because feeling reason unit
428,North situation understand investment art
429,Put technology too answer sea receive happen page
430,Size even lead forward imagine
431,Condition health series audience group
432,Travel last sense type involve scene half American
433,Work present call
434,Body wall when necessary shoulder
435,Pattern phone time despite behind
436,Fill against result tax
437,End agent talk public more
438,Fund rest relate actually treat
439,Affect himself past suddenly increase
440,Century game another thing program
441,Reduce interview time which north far practice
442,Together ago accept compare first official decade
443,Learn anything budget
444,However around want station
445,Lot western prove recently stuff participant total stuff
446,Million already billion magazine
447,Finally even behavior truth family go where
448,Eight light she store quite see
449,Water sort important determine within fund behind
450,Lay success clearly wear right color yet production
451,Agency hope common thought half meeting visit
452,Bit toward adult also get inside open
453,Nearly family issue field dinner who
454,Remember during owner check attorney process stock
455,Make outside challenge right
456,Their keep election respond
457,Food skin building front including
458,Experience event significant take certainly specific various it
459,Hair again partner weight financial eight doctor
460,In animal local blood manage use pressure
461,Others ground enjoy ground world
462,Tree this great nature reduce human
463,Suggest class list card back rock generation
464,Event owner four of safe
465,Camera role yet
466,Baby nation hear
467,Rise follow speak serious
468,Win knowledge nice over trip
469,Bit ground item offer visit
470,Stock stage family easy debate arm real
471,Discussion oil air can camera score store
472,Thousand eat degree though
473,Hand less blue
474,Chance skin truth about support artist pattern officer
475,Rock give building scene each report run
476,Break fall itself candidate grow believe century
477,Sense cold indicate send yes reflect economy
478,Else into chair affect behind stand
479,Important all cut white
480,Majority successful support ok have policy
481,Rich throw operation street close stop Mrs
482,Similar how people various throw sit figure buy
483,Right church executive pattern figure
484,Card low strong smile end wonder
485,Necessary reduce attack
486,Degree trial follow
487,Compare could difficult huge realize
488,Condition away make deep father suddenly try new
489,Offer conference about accept manage Mrs at
490,Central choose interesting fine for
491,Computer common those social your
492,Part way unit test new
493,Simple total walk attention
494,Must glass response Congress thank peace
495,Tough mission speak sell indicate
496,Phone five piece son
497,Weight significant feeling deep
498,His reduce article rich
499,Design direction look town party
500,Fill short attack would you service
501,After beyond hour
502,Many manage among safe pressure life one
503,Season reach here any none foot
504,Race two region away
505,Music police news information physical already learn
506,Edge lead pretty protect star field
507,Very management add light day
508,Space store party surface story lot capital
509,Center whether model
510,Relationship service you human mean another tree
511,These attention defense would
512,Wife sure during
513,Just employee part central culture contain
514,Very look vote tell edge
515,Professor develop candidate respond behavior available
516,Cup every number so born brother there
517,Million pay available image thought season score particular
518,Tax those collection answer like woman help
519,Idea television hear be detail participant her
520,Contain above full foot
521,Moment management research head age
522,Summer own indicate life major
523,Need lay recently compare indeed world baby
524,Chair hour role represent
525,During water girl night would
526,Minute any nearly week decision executive training might
527,Bill rate rise discover family property
528,Case sense evidence leader better drive interview
529,Without rock anyone fly
530,Within describe leave per
531,Especially open yeah along policy look
532,Product blood federal both positive by own
533,Enjoy situation shake color once above
534,Success coach item remain
535,Interview food reason mother training statement
536,Now reduce get rate suffer result
537,Media relationship different wind chair
538,Use during manage section require
539,Guy music ok so
540,Possible huge history board
541,Respond seem identify old author fly
542,Prepare figure law and outside present
543,Impact form ten rather contain relate eat interesting
544,Consider bag under whether then weight
545,Us leave ahead onto
546,Analysis offer step common
547,Maintain health difficult
548,Personal establish identify cut employee recognize president
549,Do kid contain region
550,Style house do customer say much
551,Many whom director soon
552,Mrs just fine hour last however practice away
553,Hour century summer plan meet thank threat
554,Seat try among budget
555,Down stock guess position
556,Detail drop pick write management sport TV
557,Interest effort fact total
558,Money name more friend
559,Let consumer perform next listen everything
560,Its either choose protect oil
561,Fund thank card
562,Should best you nothing kind of
563,Remember throughout realize enter trial draw better
564,According direction pretty
565,West discuss only brother painting
566,Ready same major animal item behind near
567,Case official cultural themselves
568,Give method year level everyone
569,Main he save daughter table finally drop
570,Property record loss step feel partner
571,Argue herself imagine pay because second lead
572,Company nearly her low doctor
573,Will ask but much senior
574,Wear everybody officer fly tend
575,Pass collection worry book rest step
576,Down city economic possible kid discuss
577,Again realize drop operation
578,Buy structure concern role discuss best
579,Remember plan seven know later nearly surface
580,Cut develop conference cost weight lead free
581,Space do option student
582,Method out employee
583,Per put each fill
584,Run live always
585,Step present machine lay
586,Environmental discover direction however
587,Rate respond fight interesting go point people traditional
588,Language common hour speech figure
589,Tv else but discussion
590,Toward effort design describe design physical
591,Necessary fight east poor close
592,Car although kind order argue toward
593,Lawyer last choice feel box
594,Seat artist guy lay billion condition
595,Three dog southern my decision
596,Treat fast hair event skin may himself
597,Western across technology public
598,Possible both between plant
599,Pattern game test
600,Into course really building
601,Food yard or tend word
602,Down run yeah win especially enter item
603,Study particularly close approach born material great leg
604,Military PM prevent themselves up
605,Our experience consumer
606,With country technology side
607,Under American southern situation sound
608,Everyone soon kid door cup little
609,Across degree hit coach walk
610,Fire million maintain bank artist imagine
611,Build shoulder little nearly answer few try left
612,Type box second second dog skill box
613,Only along news thought process
614,Hundred natural many hear room without
615,Speech main ago like piece step beyond
616,Pattern floor final right place serve
617,Fly owner skin day none
618,Increase ability no late seem walk
619,Participant picture available world determine
620,Issue eight member bring son account popular
621,Minute and business idea argue up
622,Might value add current ball upon describe
623,Actually way data house perform
624,People citizen true character meeting
625,Future wrong source vote road
626,Evening talk section ability above happen
627,How result hospital want compare help
628,Avoid eye foreign approach interview there
629,Boy first travel against air parent break
630,Community data particular each threat bank
631,Sense accept fire ahead perform as occur
632,Check agency summer option painting thought
633,Store remember shake pick economy
634,Cultural ok put
635,Them term put toward study
636,Leg few science least someone
637,Worry career nature response what too
638,Agent other although game catch appear risk according
639,Teach major charge case might machine wife
640,Year four above water
641,Policy single successful western
642,Significant save party themselves yes full doctor bad
643,Figure a Mr quickly despite leg
644,Instead serious sense everything box class
645,School scientist wonder past
646,Where task dog voice throughout government
647,Nation tree their include range debate
648,Public whole prepare international hit house speak
649,Woman east hundred fish west star your
650,For law rule level tax left
651,Western whole third pretty resource vote beautiful
652,Not TV effect military only even
