id,keywords
2563,Join throw show responsibility agency himself
2564,Race back team politics worry space site
2565,Quickly discuss oil girl around myself
2566,Treatment public discuss agreement now why paper
2567,Approach various son region myself buy simple white
2568,Growth against walk billion along necessary
2569,Apply stop of room
2570,Easy discussion campaign scientist blood no
2571,Determine along interesting sea
2572,Week general seat position establish move dinner
2573,Cup administration no cover garden current
2574,Adult because will though result dog
2575,Now during couple worry
2576,Serve into color everyone way
2577,Exist alone major major color example
2578,Process computer of care simply figure kitchen
2579,Scene voice PM arrive line teach
2580,Rise yard return art allow senior nothing
2581,Happen kitchen friend almost
2582,Military than three interview
2583,Program training grow story
2584,Road conference conference
2585,Measure remain sound contain
2586,Majority newspaper clear foreign among skin consider world
2587,Use chair region last
2588,Manager board anything food conference
2589,Nature movement before
2590,Glass wife hair material south
2591,Consumer race many yeah
2592,Goal about administration know condition hair affect
2593,Recognize bed indeed especially foot
2594,Time give realize girl president wife mean
2595,Pay see himself medical enter operation create
2596,Talk direction along quite study themselves
2597,Safe reduce we
2598,Send security form discover million
2599,Several become report explain memory door
2600,Garden whom husband industry environment require
2601,Million around experience know
2602,Should past under
2603,Help forget main rest threat everything mind
2604,Serious certain entire them
2605,Old young successful teach money movie get
2606,Force later ten customer give
2607,Action white popular experience
2608,Western quality stop why law rich land
2609,Ten civil industry away within
2610,High catch section few
2611,Do serious sure natural name stuff something
2612,Partner kitchen fine
2613,This office support else big
2614,Company hard company and movement I
2615,Trial grow size again five hard middle
2616,Individual everything attorney later can state language
2617,Huge nation my evidence my buy
2618,Than crime maintain agreement such leader
2619,Conference cell thank prepare also strong
2620,Institution walk table either also
2621,Reduce capital she cultural office he science
2622,Traditional help not woman yeah
2623,Affect peace a easy whether need worker
2624,Ever into right participant question most great
2625,Else husband such card watch market
2626,Go miss nor wrong medical
2627,Young red respond rich with hard
2628,Already former far appear heart
2629,Customer spend trial operation fall someone scene
2630,Care conference house them store director
2631,Firm picture imagine ahead article see
2632,Risk turn where value also peace
2633,Never production true never wish address
2634,Structure race environment specific degree can
2635,Writer fear resource management
2636,Interview check toward even
2637,Choice start make meet social third later national
2638,Away trip check late nothing claim
2639,Direction eight blue grow bill these brother
2640,Affect yet adult majority
2641,Few party commercial old brother black
2642,Risk of prevent expect
2643,Black affect white pick number
2644,Friend soon amount itself stay study eat worker
2645,Too company leg rather
2646,Police manage really image interview protect
2647,Middle assume success need most card
2648,American community item your
2649,Front name rise everyone senior bed
2650,Paper kitchen task south
2651,Choose same human trip quality give
2652,Expect although return white none relate plan
2653,Wish everything bar detail modern
2654,Day authority blood every hotel vote feel agency
2655,Fish set young stand success better
2656,Deal represent mission old Mr
2657,Education large develop his will allow have
2658,Stage concern not happy important
2659,Together painting none employee third your
2660,Miss bill why share material analysis country
2661,Successful could quite kitchen president bit for agent
2662,Take product allow tree realize middle culture
2663,Available body field various director enjoy
2664,Explain teacher herself
2665,Close go arm feeling participant design
2666,Often popular stage we across by meet
2667,Positive coach recently
2668,Stop sometimes some recognize somebody concern process
2669,Everybody because recognize through pretty best bank
2670,Reason brother really star whatever energy
2671,Fish record reason follow Democrat
2672,Able social benefit time safe poor
2673,Election stand base structure number save
2674,Imagine through world agree assume
2675,Full beautiful role long sell often
2676,Beyond they management south radio
2677,Despite find grow them send
2678,Already study yeah number election own what
2679,Security trial movement
2680,Real career human position crime
2681,War north worker too should
2682,Brother Mr result that today around successful
2683,Suffer degree north
2684,Explain from human director month
2685,Spend pay space bag office course fly
2686,Make buy blue customer some happen
2687,Size change toward research heavy
2688,Ago arrive may close want
2689,Pressure leave yourself across drug
2690,Simply measure some loss board director meet have
2691,Action list indeed six alone
2692,Hear most member seat major
2693,Be customer scene Republican
2694,System the campaign
2695,Thought hand put technology thousand
2696,Congress thank big use community appear
2697,Interest certainly our month
2698,Know south side recently claim pretty
2699,His yeah network behind help item
2700,Determine exist condition must always nor
2701,Consider matter debate fish community
2702,General I defense speech they
2703,Worker prepare response animal yet front forward
2704,Market easy pull activity identify tough
2705,Choice my north
2706,Plan toward community rest throw several environmental
2707,Data knowledge trip these need positive
2708,This until what stage give for model ahead
2709,Indicate office none
2710,Half low law add
2711,Beyond husband vote
2712,Entire security send save foreign boy general
2713,Site maintain well something production national
2714,Develop none work try
2715,Music husband agency trouble throughout do half
2716,Tonight street woman many force mother year
2717,Like prove child large might
2718,Light song because theory
2719,Performance sign me majority data happy
2720,Sort understand conference city hotel
2721,Crime painting argue the trouble without east
2722,Spend clear our local
2723,Lay score world through us data air
2724,Cold start him opportunity particularly require modern
2725,Total father himself
2726,Her add individual reduce try close sing
2727,Store brother page save
2728,Western rate story international practice hotel above
2729,Democratic because owner allow theory environment hand
2730,Purpose arm administration lose analysis
2731,Visit case mouth
2732,Interesting move bar structure anyone positive
2733,President fine cover very near miss without same
2734,Response wonder whose ready
2735,Two drop act each
2736,Cause public spend
2737,Ready man white whose seven second of hospital
2738,Visit three record occur fire grow marriage easy
2739,Kind safe sort alone American against some
2740,Walk page improve whole kind writer anyone
2741,Information contain western own imagine
2742,Wall agreement himself along yard
2743,One just cause million history stop audience
2744,Among start stand middle stage a serious
2745,Center way close measure
2746,Their three officer plan get interesting wear
2747,Campaign federal sell
2748,Place such help call run evening
2749,President yourself run tonight interest
2750,Throughout PM never manage
2751,Fight bill contain stock section issue these society
2752,Drop church tree thousand approach
2753,Drop shake story room role white carry investment
2754,Want type spend real of building
2755,View chance among whom course traditional new east
2756,Their back chance baby cup tend group
2757,We way assume relationship maybe attention
2758,Technology itself serve collection happen
2759,Career ball may
2760,Toward agent phone outside both light movie
2761,Executive thank process someone
2762,College reflect building off
2763,Whatever method mention measure financial age unit
2764,Few stand table teacher PM part
2765,Cultural member fly
2766,Evidence campaign glass decision them father computer
2767,Including off blue describe south
2768,Few why particularly information painting trip
2769,Because him increase make carry design
2770,Receive grow policy seek line
2771,It up so method identify
2772,Gun according produce piece later though
2773,Practice message true us turn blood
2774,Mission wide lot than watch
2775,Tend wait again staff claim walk suggest
2776,Relate past price
2777,Whose enter carry option best east people
2778,Democratic husband conference pull respond billion
2779,Hair everything situation tell table care board
2780,Want various attack modern step
2781,Ahead serve somebody fast owner challenge kind
2782,Person but hospital growth control end
2783,Big none fly administration region human
2784,Say them energy enough simply sea
2785,Add bank talk season in later ok gun
2786,Job mean difficult nearly reveal charge
2787,Enjoy town half exactly city show
2788,Method top whole hear like
2789,Assume stand seek church whether financial
2790,Explain chair nearly herself Democrat technology worry
2791,Paper born hard wide discuss yard
2792,Present charge dark receive enough low
2793,Up stand establish resource analysis finish political
2794,Act chair cell
2795,Money training environmental myself protect ground month
2796,Article series identify operation raise
2797,Lot across I outside recent southern international
2798,Budget table family such collection vote shoulder
2799,Similar watch each
2800,Recently law near environmental figure
2801,Full important tree south serious development
2802,Report PM manage although sometimes
2803,Risk business direction sister site task number reflect
2804,Material accept our focus
2805,Congress today chance and race size
2806,Under senior begin player
2807,Build west hour phone significant health rate
2808,Sound fund than here factor green accept
2809,Together care piece thought human avoid
2810,Audience recently difference character every soldier will
2811,Realize half society
2812,Sea sea international key
2813,Class probably attorney wind alone small
2814,Father energy brother suddenly weight
2815,Wife team man deal
2816,These wife security choose agree certain three
2817,Conference detail radio we our federal now
2818,Describe care sea exist daughter speak morning
2819,Like alone happy
2820,Stop leader like war
2821,Two soldier staff low
2822,Ready author which
2823,Something break tax must agreement
2824,Visit member medical less central yes
2825,Trouble subject economic color ago
2826,Walk power true trial
2827,Bag particular way program hair fill project
2828,All treat would now game tough
2829,However world also
2830,Idea over information window
2831,Institution resource standard possible series person unit ok
2832,Nature box new step current Mr everything assume
2833,Man through cold church their look
2834,Affect reality hospital service senior factor network my
2835,Hotel medical understand light hotel business
2836,Probably floor north far
2837,Top act chance real however decision remember policy
2838,Wait themselves she hard start
2839,Ability age measure key including main water
2840,During federal hope return
2841,Have table notice power force social traditional from
2842,Soon design perform card
2843,Talk history remain myself stage loss high
2844,In fish significant own democratic five
2845,Few next final itself main
2846,Term have between spring
2847,Meet point already can organization stay kitchen toward
2848,Lay hour world woman door
2849,Himself place deal move consider
2850,These help cause night bit discover
2851,Here down staff more
2852,Choose push blue above
2853,Group sing it approach person something report
2854,Test rather lot project
2855,List herself factor
2856,Return visit none name dark discover
2857,Product face could away she place
2858,They ask foot wind
2859,Worry major mind get executive plan me
2860,Four discover report
2861,So heart road care stand
2862,Just leader reduce oil situation ago pattern
2863,Wind team notice inside move
2864,President suffer able look tend low girl write
2865,Push book shake morning value small his
2866,Collection writer teach share trouble few
2867,Action responsibility matter simple administration data mind end
2868,Hope company option nice
2869,Cup hot mind for mouth
2870,Control government program many
2871,Add item book its human
2872,Same man simply certainly success
2873,Front source know rich discussion build bad thus
2874,Not nature defense special lay every
2875,Huge within get evidence
2876,Small argue do stop water
2877,Agency difference stay laugh
2878,Two per way light other Mrs
2879,Likely view trip identify seem
2880,Message talk collection wife it
2881,Forget toward two pattern court station
2882,Difference nature nature light TV
2883,Travel us send wife offer
2884,Attack imagine religious today their daughter enjoy evidence
2885,Thank low rich represent
2886,American others gun top decide people memory
2887,Move protect eight article south well always
2888,Ready American would away some crime respond
2889,Theory everybody face oil yourself
2890,And computer six television reality show none
2891,Husband during language behavior participant
2892,Would ready election give product enjoy born middle
2893,Fish attorney city throw try check
2894,Administration answer oil care me level
2895,Condition piece bill evening recent
2896,Else gas start color spring low
2897,Plant big prevent some until perhaps
2898,Yet any enjoy close myself change
2899,Radio agree stand support eight own
2900,Decide soldier reach body fast measure
2901,Laugh month car create citizen within win
2902,Several far concern middle heart water describe
2903,Generation not charge like couple
2904,Want than career difference none show plan
2905,Congress make fly natural tonight always
2906,Kid personal public concern ten baby
2907,Magazine do factor property
2908,Without agency rock reality light
2909,Land material maybe will news modern message
2910,Push food area between space finally
2911,Want view find total
2912,Company common performance usually
2913,The goal series environment news assume
2914,Forward wait social station learn red find
2915,Rather throughout accept hope early
2916,Just speak only science health lot effect
2917,Pull man be hospital
2918,Morning voice respond fall
2919,Congress apply sport
2920,Customer fact put
2921,Law up force third ground these cold
2922,Answer within language can
2923,Late collection point these
2924,Himself glass down particularly anyone full
2925,Probably their represent prepare address war low onto
2926,Debate number character black none perhaps
2927,Power administration quality indeed organization friend standard
2928,Name head tend character
2929,Yourself still forget case so
2930,Plan responsibility true glass economy
2931,Present large wide month smile
2932,So little keep some public contain
2933,Remember ahead admit carry
2934,Idea land loss likely different say seek
2935,View serious allow leader street five policy
2936,Will go morning rich clearly somebody black
2937,Attack avoid into law guy bar general when
2938,Cell picture push size author
2939,Course school pick few
2940,Player camera than final
2941,City view year range never move water
2942,Save represent until explain raise
2943,Suddenly live fish upon cultural we
2944,Media share reality of win foot seven
2945,Treatment may material experience find investment soldier chance
2946,Past chance color blood fast car go
2947,Participant born treatment experience win contain while
2948,Character garden it
2949,Increase meet six economic others recently home
2950,Add trip people measure fact unit product product
2951,Find party window dog yes somebody attorney
2952,Medical their choose middle full common explain
2953,Appear cold far speech
2954,Record mean something large argue indeed set
2955,Part sit discussion since college movie
2956,Energy marriage raise include scene citizen suddenly consider
2957,These crime off up both
2958,Task wife fire yourself week
2959,Born natural though design nature
2960,Realize four find cut quite table daughter television
2961,Final list economic sing shoulder
2962,Order respond many himself structure fly agreement
2963,Reality kind various current analysis
2964,Decide similar pick area air firm discover
2965,Truth throw cost respond top
2966,Again quality environment single fight decide visit
2967,Ready whose own manager true per house
2968,Receive yeah compare ready eight feel
2969,Big civil those itself avoid cover develop study
2970,Similar read science involve behavior produce learn
2971,Bar me remember civil suddenly memory
2972,Drop this anyone bank their
2973,Already son under model
2974,Evening wrong significant coach
2975,Clearly two mouth subject figure
2976,Try take soon view wide
2977,Share off help fast single
2978,Tax responsibility environment your perform best drive
2979,Network treat cell gun goal behavior
2980,Only reason cold success
2981,Which leg establish sometimes hospital
2982,We major sure job
2983,The tree again community former
2984,Small international speak sport
2985,Spring test activity use
2986,Cultural fire with letter source attack
2987,My wait time college push TV possible believe
2988,Subject street board father teach lead
2989,Now join time page along wish week
2990,Particularly employee woman smile of garden time
2991,Him less prepare mind arm
2992,Less education gun next politics
2993,Point put anyone anyone visit admit call
2994,Red tend still
2995,College dream education true week region
2996,Impact gun collection process clearly show few
2997,Themselves skin various sound
2998,Memory those enough people policy finally writer
2999,Perhaps pass big month
3000,Catch space that reduce toward
3001,Factor effect much for feel note develop job
3002,Marriage individual movie pick
3003,Guess available continue improve first
3004,Trial education remember dinner
3005,Daughter form cause student hard
3006,Available clear expert decade car
3007,Heart affect somebody success test evening four
3008,Off article decide case guy military seek agency
3009,Of happen thousand history
3010,Worker foot spring
3011,Available bag appear everybody read five very thus
3012,Training perform art common business
3013,Success particular go alone continue suddenly
3014,Picture view military man always subject attorney
3015,Who cause production development
3016,On language through want
3017,First father plant charge in night
3018,Accept fly store goal
3019,Organization mouth program population attention upon
3020,Smile painting before future late course
3021,He sea discussion seek right yeah chair course
3022,Inside national Congress least place
3023,Congress agent because tree
3024,May population size call rule
3025,Billion window meeting science
3026,Key eight now ready read development half
3027,Live perhaps during direction
3028,Character have old wish concern despite surface
3029,Section every large data born
3030,Population pick religious agency too professional
3031,Woman grow month item movement
3032,Apply southern executive of
3033,Trade debate bar drive law check might
3034,Much point scene where though alone word
3035,I be available check house leave
3036,Action mention save
3037,Nice trouble scene
3038,Build wait yes whom
3039,Hair against hear identify
3040,Wide light use just
3041,Design election music writer add
3042,Its until within health
3043,Begin else wrong letter tree
3044,Huge into consider sometimes
3045,Middle control four
3046,Practice brother time practice level someone get
3047,Conference hour during kid
3048,Instead benefit really economy ball
3049,Important including down likely direction great work
3050,Decision agent attention field
3051,During section go how such ahead answer
3052,Dream range artist economy
3053,A that despite cause particular along
3054,Travel police purpose social rich citizen avoid simply
3055,Together third miss social management character
3056,Imagine power energy
3057,Run focus ability within beautiful she
3058,International member huge
3059,Want important environmental nor left seek store guy
3060,Get administration federal college
3061,Seem capital hair
3062,Interest despite issue interest
3063,Myself surface here them garden son
3064,Cup increase throw bar drug recently far
3065,Room list over
3066,Early with degree health head truth throw
3067,Imagine something anyone family
3068,Born television machine act you child
3069,Another late local team them
3070,Window few memory no
3071,Idea save after threat
3072,Method couple animal nothing front manager school situation
3073,Day put cultural north possible
3074,Arrive natural system than room
3075,Fund billion full sign cup television
3076,Anything time item show dog
3077,Hand natural address nice
3078,Chair high heart whose action evidence technology
3079,Image until travel interest issue certain small
3080,Wish yeah mention child prevent difficult dream
3081,Can learn decade serve today realize receive
3082,Successful interview charge
3083,Result arm second south
3084,Officer travel must and rock
3085,Adult traditional huge pattern sometimes partner
3086,Drive police agency
3087,Class heavy top every
3088,Seek country star miss early
3089,Three guess simply provide
3090,Pressure guy defense fight already put
3091,Air perhaps road technology learn
3092,Administration ok human memory management mean
3093,Model particular place police treat of
3094,Hit under suggest foreign surface wear hot
3095,Apply camera financial animal bit heart dark often
3096,Follow agreement beyond whom card tree
3097,Himself finish according outside realize site
3098,Recognize reach understand yourself
3099,Cultural indeed notice each major but fund
3100,Or action value politics
3101,Point top I heavy figure often
3102,Instead heart black last reduce
3103,Wide assume without arrive six education certainly
3104,Research miss smile state address development
3105,Cell machine common teacher any itself candidate
3106,Why through specific resource way discuss tough happy
3107,Environmental actually instead travel despite public
3108,Else drop board
3109,Mention person side land doctor break
3110,Town six agreement policy
3111,Our career population
3112,Again eight value on
3113,Movement trouble only toward nice specific
3114,Morning able either trouble already
3115,Wide organization operation politics rich
3116,Shake wear current our executive
3117,Get social certainly pattern firm
3118,These past find
3119,Turn event look within bar politics town prevent
3120,Step claim first fill someone believe parent
3121,Treat many management radio protect somebody
3122,Home some stop most go him before
3123,Role strategy arrive away cost
3124,During moment development popular about weight
3125,Pretty control value leave star live
3126,Of real country state
3127,Half medical I can management audience feel receive
3128,Himself green alone though really speech
3129,Clearly hope performance someone already understand ever
3130,Billion if why real dog color information
3131,Night interest box weight within
3132,President TV whatever tend pay
3133,Tough view my hotel series year
3134,Least born office game value politics positive
3135,Him near cold TV
3136,Identify that edge face not mention ready
3137,Result clear country hard
3138,Personal sure beautiful will
3139,Thus body my member cover reflect
3140,Quite program lay
3141,Daughter world name miss seven
3142,Artist interview brother interest whom
3143,Wear significant ground yard city
3144,Least million economic brother
3145,Especially water like common wide window perhaps better
3146,Life federal today through drop teacher board
3147,Firm civil worry industry always relationship heart
3148,Media discussion rock type player difficult
3149,History keep board office property produce
3150,And so our such sing
3151,Personal or study situation health theory
3152,Worry buy task wish half thousand bill nothing
3153,Second idea agency natural
3154,Physical actually understand
3155,Family network check I music
3156,Generation subject section partner fill own especially
3157,Others ball actually person drop point
3158,Gun identify federal parent away establish
3159,Be his positive ten environment economy
3160,People music property next project usually
3161,Couple participant only including must avoid oil
3162,Begin ever whether near ten
3163,Everyone join scientist west two
3164,Tv perform choice past
3165,Compare everything major
3166,Person keep option stock mother probably under discussion
3167,General process cultural into collection mean stand
3168,Require bad spend war serious three piece
3169,Bank evidence whether man
3170,General risk since eat watch
3171,Upon sense sure grow pretty until
3172,Conference win from reduce thought
3173,Without suggest character behavior
3174,Environmental speech from enjoy cell brother raise
3175,Relate take show product college officer number
3176,Continue increase key
3177,Arrive different challenge pass
3178,Ago number let Congress write upon
3179,Tv would benefit budget five into
3180,Do figure change suggest local big central
3181,Close service like price road possible get him
3182,Federal describe nor easy nothing
3183,Catch somebody girl yourself kind law ok
3184,To authority natural poor white field however
3185,A generation forget send page economic
3186,War relate hand feeling reflect huge check
3187,Indeed concern situation
