id,keywords
1301,Democrat southern tree pull training might behind single
1302,Central wonder official west seem story machine trouble
1303,Especially cell reveal church direction several
1304,Not point opportunity can other improve job
1305,Red employee shake defense end build effect
1306,Individual him recognize position network deal thank
1307,Wish term happy language edge high
1308,Answer machine artist
1309,Loss arrive within anything
1310,Community follow short to eat soon leave
1311,Final memory want east
1312,Notice son behavior action candidate structure
1313,Find politics book best woman rather
1314,Protect read hold right may without
1315,Game likely feeling above treat member treatment
1316,Different democratic certainly answer follow much thus
1317,Music team all determine standard effect piece
1318,Relate case require turn commercial sense effort back
1319,Mr should style necessary tough
1320,Theory including food off
1321,Both mind use card
1322,Newspaper room Republican occur someone win surface
1323,Smile condition out all baby fast year indeed
1324,Think full teacher strong among financial table anything
1325,Than along those rest dog
1326,Quite soon or for prevent new
1327,Stock someone where remain
1328,Game water chance consumer approach sometimes lawyer according
1329,Democratic they accept seven
1330,Agency shake article Republican break
1331,Occur third artist upon down including practice set
1332,Pay but like art modern contain him
1333,College box wide probably audience Mrs
1334,Finally expect eat will various
1335,Film seek goal only
1336,Idea finally over impact
1337,Treatment whom plant face experience right
1338,Hand major would table
1339,Affect develop just
1340,Human break note return instead must
1341,Agency born site three nature
1342,Field present listen nation
1343,Fish parent those car
1344,Source hit company occur
1345,Friend rise plan success impact
1346,Prove method network every
1347,Stuff quickly girl
1348,Together data us create
1349,Defense later spend follow national this like significant
1350,Across couple one trial television
1351,Mission off get president
1352,Approach our eye trial relationship
1353,Safe foreign the green
1354,Thousand a everybody
1355,Discuss spring woman least
1356,Around window ask everyone
1357,Represent public his agreement
1358,Know it perform explain fact make also
1359,Instead strategy subject mission
1360,To including show better soldier know
1361,A course anything agency wind determine out
1362,Situation marriage rate she image mission perhaps meeting
1363,Assume space someone plant attorney hot record environmental
1364,Turn pick both citizen
1365,Treatment strong hard know
1366,Job mission report art create
1367,Up scene think against
1368,Trade threat window road drive less conference
1369,Strategy occur eight above
1370,Government available hotel
1371,There such pick it skill school
1372,Big answer if call team
1373,Citizen section policy maybe report allow oil
1374,A meet something reflect network keep
1375,Much keep keep by kind wind
1376,Picture develop goal room series structure expert
1377,Task economic treat my
1378,Wide start rate prevent guy become stock
1379,Window exactly maintain issue they make whatever
1380,Because receive raise several work trade
1381,Raise dinner better rise action forget leg
1382,Theory crime top central
1383,Right conference involve miss degree close production
1384,Stop scene page least explain education seem
1385,Particular true head painting center when
1386,Include season full wish society same land send
1387,Sound even weight always late able size audience
1388,Vote class price simple stuff
1389,Responsibility conference better
1390,Determine his baby person
1391,Challenge why body pressure long your those
1392,Help meeting coach probably drug which tough
1393,Around owner make few there
1394,Side our case animal space call
1395,Present ready who several
1396,Cut production local consider scene social according
1397,Television statement read drug artist small
1398,Box speech either country issue all west us
1399,President hospital score over
1400,Stop cold provide risk still feeling near imagine
1401,Unit current pass
1402,Financial seek response though appear day
1403,Bad analysis without cause which
1404,Can true drug represent power challenge government become
1405,Record everyone factor not view data
1406,Already mention somebody turn thus
1407,Price market ready own skill and idea
1408,Everybody discussion someone business dark concern treat
1409,Enter skill use final usually worker movement
1410,Month sometimes tonight left sign country
1411,Onto thing talk control
1412,Weight week effort easy development center
1413,Race test health return artist
1414,Current reality especially garden everybody use
1415,Production building certainly movement drug know
1416,Particularly score order challenge become management
1417,Often feel little
1418,Realize treatment available
1419,Clearly film imagine take bank really field
1420,Finally board house month
1421,Whom upon opportunity week speech
1422,Respond attorney Republican office approach financial
1423,Blood understand manager bank
1424,Side authority receive method enter book material
1425,Land side professor computer detail let
1426,Become ago traditional eight share see
1427,Nothing meeting good yet doctor manage game easy
1428,Talk drug she when career
1429,Small culture find ability
1430,It player somebody church improve debate phone detail
1431,Difficult lead say available gun can still class
1432,Gun quickly successful
1433,Remain south environment tough explain common
1434,Hotel sell table large material who party account
1435,Gun easy trouble technology sea example though which
1436,American instead kitchen year her
1437,Green while career in whatever ready
1438,Goal dream cause wife describe
1439,Whose successful yet church plan image
1440,World shake campaign far concern
1441,Put dog recent
1442,By suggest force hot
1443,Away figure mean such
1444,Consumer choose across away itself method adult
1445,Hand near now girl respond
1446,Like month list cup trouble
1447,Myself special art once character wait allow
1448,Off somebody hour upon individual
1449,Admit benefit game
1450,Strong push oil so relationship property cell the
1451,House image choose foot want
1452,Scientist system tough less war
1453,Political the imagine with field find ok
1454,Fight song likely our for while
1455,Tv student score majority sit
1456,Better give charge health allow admit
1457,Per large position step material surface
1458,Significant rise art pretty buy adult
1459,Work service modern understand enjoy
1460,Enough development personal anyone everybody property
1461,Responsibility fight attorney bill ready probably side
1462,Through page high Democrat go nearly office room
1463,Skill because and despite follow pass
1464,Wear thus low
1465,Contain future bring without system local
1466,Anything assume fear sea discover
1467,Movie movement natural suggest science
1468,Foot agency trade operation himself language free option
1469,Magazine how role trip difference election race glass
1470,American inside about property need
1471,Right pull then window professor
1472,Board fact already point continue same
1473,Else policy eat Democrat
1474,Care finally between
1475,Throw view region born test
1476,Republican bed throughout hotel firm pretty
1477,Training responsibility continue stay trade activity four true
1478,Building information fact conference administration side conference
1479,Appear too like college early grow
1480,High town list great letter
1481,Over family she theory wrong
1482,Market sell research hope
1483,Just late effort magazine garden production
1484,House under prevent western drop
1485,Another gas artist large study
1486,Ground open imagine road
1487,Should present foot the more usually
1488,Popular himself truth word energy imagine back daughter
1489,Rate investment onto
1490,Building I run
1491,Large treatment conference hear financial
1492,Play join true interview goal response debate
1493,Unit idea child run western away voice
1494,Share training scene
1495,Meet hear coach mission your
1496,Computer brother maybe recognize newspaper
1497,Require increase out require father affect interesting
1498,Officer them begin manager
1499,Home especially other address however school
1500,If modern occur source both
1501,Single them born appear take
1502,Cell test or prove trade exist
1503,Lay then any baby physical realize
1504,Source state well four away event assume agency
1505,Three beat attack far often magazine
1506,Term into significant any bag
1507,From outside interest hotel letter wear
1508,West model half trial day world reality image
1509,Report role yard risk benefit keep quite
1510,Movement board remain scientist
1511,Perform purpose anything yard support
1512,Environment radio report four
1513,Cut weight term almost nor
1514,Position vote from edge support newspaper
1515,We scene economic ahead remain message
1516,Finish party nothing couple sing adult fast official
1517,Including research if show item minute traditional
1518,Of artist president live tonight project
1519,Drop consumer boy fill them
1520,Blue arrive gas
1521,To black size edge pick mention must
1522,Popular recent ever stay grow choice care minute
1523,Seem sell professional network attack visit
1524,Action nation energy open imagine information
1525,Consumer plant sell crime should test material
1526,Ten into population
1527,Democrat mention clear follow protect return group character
1528,Establish ask term city area
1529,Seven support situation all food
1530,Necessary into family certain four culture wonder
1531,Wind fill will seem yourself
1532,West professional relate reflect tonight point sister
1533,Begin party among right night discussion
1534,Itself small seven our information brother our
1535,Father save special like south else
1536,Threat democratic kind floor
1537,Sport involve beautiful financial
1538,North I impact nothing clear start much lot
1539,Book such peace suffer
1540,Bag mean act voice mother
1541,Really work stage chance with tough film
1542,Give certain a fill
1543,Improve ability specific conference
1544,Trip type or know its start have other
1545,Spring word water simple thousand
1546,Choose home since teacher in available safe
1547,Environment career address project control guess
1548,Baby market sell there sell treatment agree time
1549,When bill series stuff
1550,Determine right officer save put under imagine
1551,Left three full young what
1552,Summer station record price election effect policy will
1553,Image edge pretty big father employee ready
1554,Network red enter social where heart address
1555,Amount become factor politics
1556,Wall program involve factor economy week
1557,Data newspaper let general
1558,Middle admit Democrat term but
1559,Send push agreement likely first pretty bank its
1560,Pm life head laugh political
1561,Artist admit force brother mention send
1562,Range inside defense enter skin
1563,Performance any resource heart
1564,Country spend management that
1565,Season truth ask draw employee
1566,Bar drug sell consider
1567,Degree mother factor report hotel short magazine
1568,Join before alone Mrs
1569,Go order vote believe pick follow
1570,Artist image help above board
1571,Power reveal drug
1572,Down generation recently national experience
1573,Everyone strategy none garden marriage direction
1574,Our color process close who drug matter
1575,Sport concern challenge far bar who strong
1576,Fund spend east more
1577,And matter should history study my yourself
1578,Serve appear expect never will
1579,Challenge miss market official investment economy suffer
1580,Trouble firm surface must control
1581,General garden outside car southern development myself
1582,Away risk second partner remain discover capital owner
1583,Beyond explain recently shoulder debate
1584,Whom sure the
1585,Move them race when sort pattern do
1586,Skin town fine goal produce performance place
1587,Around weight would save
1588,Soldier as late car
1589,Suffer national I approach test choice recognize
1590,Listen operation again network will enjoy set
1591,Customer laugh face five student sure throw
1592,Relationship simply provide drug interesting
1593,Cultural loss sit final
1594,Generation arrive actually time we system
1595,Catch daughter million event check design
1596,Thousand can day per
1597,Under fly skin fill
1598,Anything watch story Democrat point
1599,Reach worker free difficult
1600,War stand college
1601,Window difference area though American light property production
1602,Prove eat standard newspaper education
1603,Thank good economic provide common identify pressure
1604,Crime western less mother affect necessary few
1605,Space because city close
1606,Physical that couple successful hit never
1607,Wind write newspaper another keep treatment effect
1608,From manager know very suggest less first
1609,Wide community news race
1610,Control resource air
1611,Not happen couple rule others yourself
1612,Parent once trouble star
1613,Minute whether others huge great page cultural
1614,Professional nothing tax remain eye suddenly
1615,Pick me south military edge future day sister
1616,Claim student point end throughout nothing discover
1617,Hard guess article simply yet plan business
1618,Your wide exactly another break investment
1619,I some his prepare task
1620,Value my hard policy
1621,Network western team
1622,Understand fight season develop book
1623,Television everyone candidate huge during public
1624,History watch carry treat on which
1625,Amount charge agent type tax class early
1626,Defense really rise environment hit may whole
1627,Me for situation some
1628,Truth everyone agency father open player
1629,Suggest baby big grow food minute response someone
1630,Wonder only far fine direction bad explain
1631,Office value career reduce situation particularly
1632,Program use blue range
1633,Wonder knowledge PM according purpose
1634,Purpose near Republican building
1635,Four gas mouth
1636,Hope feel early
1637,Occur particularly force into campaign know meeting sign
1638,Science growth mention argue
1639,Writer perform whatever later explain
1640,Worry message walk year use
1641,Partner only push yeah indicate trial
1642,Social trial us way girl
1643,Subject together light exactly
1644,Generation choose decade good drug
1645,Friend to treat see media attorney nor
1646,Letter heart history matter beat marriage
1647,Bring bank its and rise pull person
1648,Natural final development
1649,Play huge final dog point education
1650,Than mind student
1651,Line memory in let card land
1652,Low unit both already
1653,Something sport data order account young
1654,Present bag analysis get allow first
1655,Indeed bag of near quite son accept
1656,Center laugh child allow
1657,Any case actually me
1658,Nice perhaps either paper option writer
1659,Threat or prove
1660,Fish science company past design huge
1661,History area couple my deep develop
1662,Record time animal enough him gas like
1663,Research garden short probably open floor employee
1664,Budget of hotel his bar
1665,Analysis positive product window green still
1666,Activity her whether heavy her early son
1667,Father recognize anything
1668,Find human drive manage
1669,Whole officer citizen miss final relationship
1670,Picture but exactly hear company argue wrong
1671,Officer fight participant never
1672,Hand tell benefit especially
1673,Sound whether possible five energy
1674,Professional college feel example choice oil
1675,Situation almost well foot
1676,Half movie center position
1677,Early do value glass
1678,Hundred room wide several get
1679,Rise how whom public news face
1680,Both especially call owner church over
1681,Free goal fine treat yes now sometimes
1682,Wide wish international blue animal popular
1683,Agree reason long
1684,Minute deep relate onto argue what
1685,Change early stage drop
1686,Security simply for trip base page
1687,Box day such process son
1688,Big direction free third citizen item
1689,Into popular shoulder name hard allow until
1690,Bank rise subject beautiful feeling several
1691,Seven save order model be far behavior
1692,Wall development response pressure bar
1693,Within middle event sell experience dark a task
1694,Hundred parent animal away
1695,Clearly group interest discuss sign thus
1696,Consumer remain radio site collection
1697,Approach area election customer
1698,There quality image four vote notice three
1699,Financial response fund raise
1700,Data should moment particularly suggest though hair
1701,What eat southern clearly stage
1702,Lose fine program unit
1703,Trouble radio of each walk
1704,Far mission piece where fear likely general
1705,Reason say bank marriage
1706,Research day everyone relate themselves put during group
1707,Goal until game think study law large
1708,Exist election resource address call
1709,Where leg range plant present
1710,Impact purpose tonight recent east value fast
1711,Race manage body prevent
1712,Know before someone word seat produce
1713,Consumer building our according
1714,Our identify page than
1715,Simply example level account truth past here
1716,Rather election stay thousand executive answer something travel
1717,Million know consider thus account our
1718,Three listen minute inside stage again activity
1719,Worry involve sea skin approach guy modern
1720,Arrive rise determine service property
1721,Station of expert day heavy
1722,Save later can throw television
1723,Trip push them
1724,Pull knowledge control watch federal
1725,When agreement despite
1726,Yet such down successful economic
1727,Need movie glass arrive family rule available community
1728,East woman hotel think require choice
1729,Argue model on rest
1730,Outside natural well support possible sea financial
1731,Speak system in will quite
1732,Space approach simply
1733,Congress wrong really score billion
1734,Professor east allow professor red artist air
1735,Listen among various
1736,Model whom choose
1737,His fight economic say
1738,Bank summer defense similar
1739,Increase dinner information camera worker book
1740,National information image score international
1741,Significant majority child environment
1742,Position third lot note
1743,Before involve daughter although tree
1744,Glass decision why especially debate Mr
1745,Civil practice seat success individual vote worry
1746,Nation cup develop present must control
1747,Already always talk doctor cell
1748,Computer general stuff common both hundred
1749,Compare dog level development everybody say
1750,Every you blood skill under
1751,White paper political city kind
1752,Federal five real action commercial on number
1753,Understand exactly treatment point film space party
1754,Spring get power instead thank
1755,Care democratic beautiful behavior
1756,Article hour tree word local cold
1757,Director my would walk
1758,Everyone marriage lay along send party subject
1759,Other daughter similar help author
1760,Ago head we require
1761,Best threat discuss choice
1762,Perform last those machine article
1763,Affect direction with of improve success action suffer
1764,Add over owner three
1765,Money agree make both onto
1766,Gas capital various experience general huge
1767,Democrat will yard past quickly
1768,Various successful deal data
1769,American serve beautiful field thing
1770,Blood remember drop value
1771,Something television view always hand large indicate
1772,Into his standard vote it record radio
1773,Know despite camera finally point both baby
1774,Southern agreement career
1775,Stage scene note
1776,Behavior after call should news cell
1777,Animal bring laugh difference deep local light on
1778,Build present network catch
1779,International rule wonder specific
1780,Grow record sing either key budget nor
1781,Break painting unit size to military
1782,Forget star onto series involve determine
1783,Value lot civil pattern be stage learn modern
1784,Fire rise include left central likely
1785,Team while goal beyond tell four example daughter
1786,Television and rise understand cup Democrat
1787,Indicate foot clear another team
1788,Like after common role cell information
1789,Although politics draw lead game
1790,Writer drug help economic protect pick necessary fill
1791,Plant quality free discover fine shake
1792,Against region candidate road
1793,Bit this each best analysis time
1794,Step get ground beautiful pick two answer
1795,Cause everyone leave spend style position
1796,View national in bank nor receive west force
1797,Forward top model for morning word wide political
1798,Enter in material from natural get
1799,Say space south field
1800,Recent thank full performance
1801,Cold dream back wide animal high fish pretty
1802,Popular often none he seek
1803,Question beyond it
1804,Never address some skill receive
1805,Stuff hope agency
1806,Begin rule apply walk human best consumer
1807,Yard time heavy common guy PM beautiful
1808,War build some will student own
1809,Different respond name
1810,Can fact account wind study method
1811,Much military evening open food official true
1812,Administration by name million
1813,Face society yes range reveal guess item movement
1814,So cause attention future shake strategy
1815,Dog drug red less from education
1816,Tend various change nothing
1817,Return term sing modern store figure economy choose
1818,Cold hard agreement concern may behavior
1819,Himself thing adult receive difficult two follow
1820,Explain back very work
1821,Practice and art move north carry coach
1822,Great write must agreement offer ok
1823,Election ground seat girl dark vote customer
1824,Response bring kind huge address rise
1825,Medical do cup say thousand support institution past
1826,Discussion attention rock important
1827,Everything space state movement only
1828,Would our successful happen
1829,Page tax note smile
1830,Season compare tonight blue
1831,Notice one house worker
1832,Where now again
1833,Strong less safe fight
1834,Become bad month interest continue
1835,Similar clear include staff book impact
1836,Why green as south
1837,Send improve firm
1838,Hit his when season religious plant Congress leave
1839,Not because realize
1840,Space lawyer draw indeed yes sit range
1841,Arm just tell huge floor
1842,Industry enough effect because staff great
1843,Push material ok weight reveal speech the by
1844,Budget defense throughout her movie TV common
1845,Home price change walk share onto generation heart
1846,Court computer specific likely lead step medical
1847,Receive which and ability
1848,Energy everything doctor impact material population phone
1849,Side history light bad by evening thousand
1850,Present sing physical grow order whole management should
1851,Ask peace ahead suddenly
1852,Thing kid local talk likely land impact
1853,Central responsibility record nature affect since knowledge
1854,Seem model development television since simply
1855,Allow term structure popular deal dark town reach
1856,Benefit not center
1857,Animal public wish example evidence adult
1858,Choose go sit operation service product
1859,Decade deal will despite catch
1860,Performance however discussion environment
1861,Past theory together thus spring art
1862,Cause beat ask meet
1863,Happen else partner
1864,Song read middle sport
1865,American program option cup loss despite
1866,Environmental real improve consider occur eight
1867,Apply attention since between employee sing pull
1868,Risk sit exist assume else
1869,Note sing this letter ago large
1870,Score apply beautiful break response note possible
1871,Action environment discover material chance
1872,Occur professional explain family
1873,Big near bank entire the moment sport
1874,Church design life coach show myself program
1875,Better to few few
1876,We list state case middle require leg something
1877,Any how situation arrive and
1878,Law right fight night wait economy analysis
1879,Less executive give eye or
1880,Better close heavy medical none chance mind occur
1881,Voice common to suddenly government budget dog
1882,Admit notice choice computer own here citizen finally
1883,Table score guy husband choice thank
1884,Other design charge talk parent television
1885,Phone finish one message walk consider contain
1886,People himself worker traditional almost herself most
1887,Fire seem international month whether drive
1888,Represent thought blue quickly try
1889,Cost write fill seat
1890,Pick yeah person join truth structure officer stand
1891,Whose office remember number factor
1892,Apply well where a according development
1893,Suffer present determine different heart upon free relate
1894,Avoid general painting miss policy
1895,In out physical five president human
1896,Now his marriage real
1897,Question contain character fall
1898,Situation everything rate Congress family cut
1899,Happy program herself
1900,Whom black affect on service
1901,Heart new summer
1902,Amount particular option point fight
1903,Form impact trip environmental see while manage send
1904,Quality pattern none citizen suffer
1905,Result husband popular just do nation firm
1906,Action make respond know across
1907,Factor bill model audience picture enter return thought
1908,Authority sit support go
1909,Law maintain worker month
1910,Help police in action century your
1911,Different audience present some
1912,Baby group amount set
1913,Newspaper expect rate happy majority
1914,Gas source current pull say reason stock
1915,Artist direction view history available exactly enough
1916,Enjoy figure left
1917,My along officer improve goal happy tough size
1918,Imagine painting card age take exactly down especially
1919,Mind door box whole
1920,Property never risk rich herself
1921,Little try everybody try
1922,Physical receive participant guess
1923,Pressure choice write money view top hear deep
1924,Kid account medical believe by
