id,keywords
1925,Important teach book make
1926,Reflect relate include according institution manage girl
1927,Job organization difference option deal
1928,Center degree under support
1929,Senior few north attack environment adult challenge with
1930,Husband end drug find floor campaign system
1931,Environment star claim fear different plant table
1932,Year safe will watch only involve level its
1933,Person production away throughout most piece sure
1934,Project country development author enjoy commercial
1935,Explain fear ball ok space morning
1936,Health analysis hear fill compare consumer near
1937,Dream enjoy policy
1938,Free on create be because rule range
1939,Win painting that Mrs language
1940,Media billion describe thank Republican west he
1941,Player marriage guy away recognize step
1942,Green fish per open could article
1943,Class PM later plan car street
1944,Walk doctor maybe voice indeed test onto
1945,Approach indeed brother agree strong environmental ability
1946,No area and visit eye
1947,That expert rest south quickly better five whatever
1948,Serious society marriage audience four idea
1949,Again certain shake country
1950,Century must there father community
1951,Those person experience expect oil
1952,Operation television cup year work
1953,Watch police whose voice firm may hold
1954,Recognize every often return here
1955,Real sense report off finish trip better
1956,Surface people source almost book laugh
1957,First blue he task position parent
1958,Believe us street ready
1959,Floor arm who charge old
1960,Accept by language call in couple whatever
1961,Never fight wife serve month
1962,Federal institution suffer discuss
1963,Gas other summer per which two
1964,Agent follow including about
1965,Dark serve walk player
1966,Remain place off when us go
1967,Street might ever process evening none pretty
1968,Sign effort purpose
1969,Exist camera test drug air stand
1970,Degree heavy arm top participant herself hand
1971,Big determine message nice machine since thousand
1972,Choice edge his when administration free
1973,Pm factor arrive old build start
1974,Price store difficult nor
1975,Produce theory rate set response difference loss effect
1976,Group might red meet TV debate
1977,Look program middle response purpose most approach
1978,Material over themselves let
1979,When contain although left
1980,Ball cause until
1981,Bad art candidate response billion
1982,Bed hot training choose claim seven catch
1983,Year weight back few few memory
1984,Stand sure position school
1985,Seven work professor sell
1986,Board difference cause believe
1987,Less catch treatment increase itself my more
1988,Necessary lead to among
1989,Include worry catch shake method
1990,Prepare friend position born not east low
1991,Thousand year move which
1992,Assume imagine enter just left
1993,Some truth report
1994,Pretty dog know
1995,Campaign it agent win
1996,Group cold begin mother
1997,Young effect along everybody democratic
1998,Close the of party sit represent relate
1999,Word fund page baby but course
2000,Woman good build could sense form
2001,Unit claim site put break
2002,Then price read
2003,Leader show support according into
2004,Table maybe increase today offer total
2005,Adult audience boy development throw
2006,Physical accept phone subject commercial camera worry
2007,Change class professional help son
2008,Despite fight most our
2009,Actually democratic sell different same market
2010,Work charge every mouth group system today
2011,Yet stock should industry relate think see
2012,Recognize most easy contain just forward no
2013,Message base public adult various
2014,Billion and discussion green chair
2015,According case animal list threat ten
2016,Nice onto green executive include think
2017,Mrs per development window get large back
2018,Option far realize site direction soldier heavy
2019,Commercial far risk recently cup window second
2020,Girl decade television produce my within
2021,Foot art plan difference push
2022,Evening direction study news or able they
2023,Partner alone decision campaign end unit any
2024,College ok save under bring drive leader
2025,Be wait five yet
2026,Safe physical floor hospital follow
2027,Wall memory leave TV network recognize identify
2028,Know instead owner center way stay
2029,Tv describe if wonder hit impact simple
2030,Board attention stage
2031,Face tree certain she least
2032,Avoid open necessary hundred deal account
2033,Answer save policy strong some option
2034,Consider look standard each certainly reflect
2035,Those yeah choose believe
2036,News drop all thank improve
2037,Last yet explain body market ready
2038,Much answer wide entire speak mission
2039,Into remember easy her expect
2040,Sister agent Mr same couple direction summer political
2041,Short since indicate financial consumer myself
2042,World south only about provide
2043,Religious country admit participant civil
2044,Second house check three learn
2045,Start recognize before piece help no concern half
2046,Offer teacher present edge forward pull nature
2047,Feeling important happen perform little thank item major
2048,Day responsibility get
2049,Career pick goal
2050,Energy anyone perhaps threat value government
2051,Kind box eight type break official
2052,Little say federal think
2053,Executive hot herself call better idea almost
2054,Way act ability
2055,Game later technology
2056,Everyone their group tax itself ten
2057,Local late travel tough decision
2058,Collection anyone something amount
2059,Anything front provide pull speech one model head
2060,Summer top require rest sell
2061,New character stock ok toward position painting remember
2062,Result measure wrong but imagine list with
2063,Big into push special eye give
2064,Appear professional price sort forget performance entire
2065,Method entire be beautiful season data use section
2066,Over six this process actually age none prevent
2067,Area behavior marriage since despite specific
2068,Radio audience far data
2069,Analysis far beautiful evidence customer field green
2070,Sense race add mention would
2071,Quickly talk two Democrat
2072,Example beyond check hear like style now
2073,Every thus suggest table
2074,Tree skill free value
2075,Report training financial international forward candidate my
2076,Chance himself cost left record record inside
2077,Down position baby eye wrong
2078,Short item laugh door quickly
2079,Join TV blue condition improve health
2080,Specific unit difference could conference
2081,Happen stop production seven
2082,Need level school
2083,Crime ago figure turn story wall
2084,Parent look husband cultural road
2085,Cost charge order ability cost
2086,Spring their analysis north according
2087,Tell front form away result how team happen
2088,Because tree three including several
2089,Strategy draw foreign way station science industry
2090,Face know bit
2091,With court future toward remain
2092,Crime many program charge
2093,Throw write school reflect surface item center central
2094,Ability serve deep but
2095,Central message culture bar change
2096,Career experience research lot respond
2097,See democratic dark sound thought expect law speak
2098,Return art opportunity go operation
2099,City type time
2100,Believe which teach build oil
2101,Town skill write television loss
2102,Capital south collection land treat line prove
2103,Usually million evening one
2104,Agree old garden
2105,Leg hundred service dinner
2106,Other leader local company design
2107,Benefit painting expert close husband article
2108,Decide father course road crime decision trip
2109,Early civil reflect less color do
2110,Yes record support majority
2111,Benefit interesting defense build
2112,Space help green speak bit into
2113,Recently style here hair area certain choice
2114,Look increase analysis book attack point radio
2115,Development window least talk good
2116,Crime pattern friend law ready
2117,Economic relationship something heart this view
2118,Institution reveal you
2119,Social picture talk perhaps about concern little
2120,Drop bit last certainly investment certain
2121,Probably through word feeling reflect
2122,Better response because area
2123,And just different data
2124,For thousand fast agree
2125,Maintain spring check seem increase available evening push
2126,Child ahead head
2127,Each wish million fine owner send
2128,Environmental family respond position marriage major
2129,Condition Mrs us democratic still event shake maintain
2130,Spend rate place again
2131,Huge think set listen all
2132,Effort raise yes
2133,Red under would color learn
2134,Chance all later various
2135,Money future degree customer happy air
2136,Chair food over
2137,Population management actually air
2138,Window investment image
2139,Score force street wonder rise
2140,Attorney agree candidate responsibility
2141,Interesting floor design forward box
2142,Every door notice apply response short
2143,Might site near
2144,Some miss at simple
2145,Than specific deal like religious outside participant
2146,Base house today accept theory here
2147,Again ball newspaper statement
2148,Reduce response general
2149,Explain care he person
2150,Support few attorney guy
2151,Investment can week other interest alone early
2152,Great control choice between enter
2153,Go effort international low
2154,Small race most beat just
2155,Person car their performance
2156,Conference research her weight
2157,Network fast to
2158,Difficult arm where key arrive like clear
2159,Member authority while amount property
2160,Should buy positive
2161,Air develop agreement thousand particular
2162,Left blood business enough show machine light
2163,Business heart song now stuff prevent
2164,Create health still century have
2165,Upon hot like really quite
2166,Wonder human discuss will system seat
2167,Structure agreement bit budget teach adult
2168,Too join across listen
2169,Source wait either ready pass marriage
2170,Nation hospital blood
2171,Loss tell and another upon between
2172,Unit management hospital heavy his
2173,Use door discuss indeed sing try
2174,Result people sport truth difference several pull
2175,Kind main number guess how
2176,Politics forget pass born source never begin water
2177,College condition somebody admit enjoy
2178,Black ok quite seek actually
2179,Voice team situation sign
2180,Perform always take street agreement
2181,Standard receive each
2182,About time those part
2183,Strategy artist small station
2184,Base collection economic check item floor phone Mr
2185,Again agency can fine prove party go
2186,Four continue central truth
2187,Generation chair statement politics far task
2188,Run next outside present bad
2189,Hour feel least dream
2190,Name physical wish treatment short program
2191,Section new young little radio for
2192,Law reduce describe soldier any control
2193,Force word common also media
2194,Remember right continue
2195,Yeah money guy watch unit Mrs
2196,Team any mention under
2197,Movie door charge simply environmental child know
2198,Later dream economic forward word run plan
2199,Should court everything several
2200,Off also individual cold hand
2201,Have development goal wind door
2202,Quality soldier others voice
2203,System trial of Congress
2204,Pick instead sound drug knowledge significant
2205,Help beyond instead seek morning
2206,Media year continue
2207,Level recent rock spend relate
2208,Magazine happy international change
2209,Describe debate wife
2210,Station score commercial shoulder rate
2211,Trip discover second fine relationship oil
2212,Head system entire
2213,Ever ability both read fill apply billion
2214,Anything strong attack
2215,Instead security wonder weight
2216,Simple about smile child draw
2217,Off pressure leader professor no or
2218,College article usually answer
2219,Green market program others memory free
2220,Food should time
2221,There professional democratic store able
2222,Establish guess term situation
2223,Adult myself end of
2224,Think send maybe strong
2225,Gas add challenge chair event any
2226,Red dream conference land maintain tax even
2227,Force statement none live world speak admit
2228,Account forward little allow meeting discover assume
2229,Behavior wall investment safe particularly
2230,Hear former material woman treatment
2231,Current collection tree food serious amount
2232,Buy travel range interview woman material conference
2233,Into pick where wait fire defense
2234,Quite act social people feeling
2235,Interest almost carry try sea ready
2236,Candidate sometimes forget turn however production eat
2237,Born learn various field
2238,Check street chair wonder blue system
2239,Option try leave local leader
2240,Why condition event area
2241,History old free include minute
2242,Event American analysis station subject citizen
2243,Social enjoy remain
2244,Ahead kind necessary question later drive
2245,Of everything real week social
2246,Too system wish wind change
2247,Answer full concern wrong decide
2248,Include source responsibility religious involve successful year
2249,Evidence fire face operation page lead state
2250,Own total off
2251,Agent animal draw lot
2252,Religious friend miss thing recent official
2253,Do room rise
2254,Toward detail identify one street
2255,Century a exactly each fish back price but
2256,Mouth include lot across need treat
2257,Miss character popular subject note out task
2258,Thank among western every stuff policy
2259,Officer these bring very
2260,Occur body under same
2261,Market deal popular writer none
2262,Industry beat benefit western
2263,Huge cost president race else walk teacher
2264,Model mention win action laugh treat
2265,Detail truth discussion oil yourself structure difficult
2266,Song individual store most country fill
2267,Military discussion throw material around change
2268,Major tough million cut manage
2269,Former attention contain would rise wrong budget
2270,Occur population national woman work
2271,Common tell indeed system
2272,Work order drug describe most industry sit
2273,Let bar billion daughter light
2274,Table government decide around behavior white likely
2275,Responsibility campaign much all machine maybe
2276,Very student eye present son include challenge
2277,Election current free recently
2278,Story we water woman son might
2279,Along but so develop analysis ball
2280,Yourself north clearly travel
2281,Letter someone least foreign
2282,Cup own set begin thousand structure student opportunity
2283,Huge focus summer film color only
2284,Receive important region instead animal society
2285,You enter get senior stop step page
2286,Fish wrong beautiful magazine language exist
2287,Executive senior grow interest forward
2288,Dark board myself Democrat
2289,Choice administration local thank
2290,Decade technology nearly factor every
2291,Win miss figure full raise
2292,Within now thank could book
2293,Behavior scientist bar hold police away the grow
2294,Develop fast health middle instead nothing best century
2295,I class build order money teacher care use
2296,Leave capital central front spend keep
2297,Week lay wait young those
2298,Forget sing imagine under
2299,Hard power service consider hear career commercial
2300,Top until phone pass
2301,Appear either recent class treat
2302,Watch without sense benefit environmental break project
2303,Hospital probably discuss present Mr nothing
2304,Pay buy book western name born
2305,Theory live report ten
2306,Program news town thing next everyone
2307,Level send tend step class compare
2308,Imagine alone yard
2309,Far administration them company value drug home
2310,Foot major strong set improve possible know
2311,Arm main concern magazine anyone such
2312,Heavy right role book
2313,On beat society
2314,Clearly only clearly foot civil want factor
2315,Also high usually move yard employee
2316,General event paper paper message nothing
2317,Cost part change
2318,Look that crime tell instead
2319,Risk serious cold face question task
2320,Wide like order federal generation
2321,Oil outside seem as order development
2322,Especially speech several window education between ever
2323,Able yes significant determine husband score
2324,Office difference where card growth contain trade four
2325,Whole send choice under remain key
2326,Movie series rate upon
2327,Have everybody body above rich
2328,Space care various program large writer
2329,Social drive early follow grow
2330,Pm space stuff blue child cold enough
2331,Follow skin blood apply when
2332,Own able society serious behind effect quality
2333,Ground indeed position behavior though
2334,Tv mind ready long develop
2335,Force PM voice toward
2336,Line executive leader able bad region style inside
2337,Blue late north
2338,Figure born really hot west
2339,Nearly case rest do source mention action
2340,Personal paper body term forget
2341,Player final kid training
2342,Increase help score could message base find
2343,Spring beautiful off friend born each create me
2344,Every bring exist art fast bad
2345,Like happen poor lay score
2346,National people much fire
2347,Blood head bank somebody figure network
2348,Close town voice than represent next
2349,Just media outside cold night fish
2350,Seven around attack they high husband year
2351,Thought much him world visit market
2352,Ball like wife choice fish various cause
2353,Majority purpose use
2354,Pick road loss follow
2355,Purpose financial who despite near brother important fall
2356,Data wall forward production
2357,Democratic go Mrs PM research drug
2358,Work personal low house
2359,Want safe let through car together
2360,Form in north size attack
2361,Later simple impact manager clear design we
2362,Main speak too if she body three
2363,Great trip south some lawyer
2364,Fine last most after end around sing
2365,Finish chair get fund must hour commercial
2366,His early open daughter
2367,Agreement would many purpose know billion
2368,Special program scene question
2369,Positive group as writer
2370,Nor dinner that notice measure chair early pattern
2371,Successful but without every
2372,Style young consumer far
2373,Remember store effort both attention training
2374,Tonight design campaign help glass political
2375,Since suffer remain prove provide
2376,Well apply program full range sing
2377,Onto decision work close
2378,Analysis price simple far try
2379,Along seem send today report
2380,Similar recent item specific put deep feeling
2381,Child relationship point carry power hospital scientist natural
2382,Bag far crime whom general look pattern nor
2383,Good officer situation break cup
2384,Main say film feeling leave
2385,Work oil national idea
2386,Those certainly action evening fund many
2387,West build they size society night surface
2388,Office country appear range
2389,Right tend foot beyond parent Congress
2390,Baby society office successful
2391,Ask media more in response energy
2392,Per without bed safe
2393,Strong news support not easy once around
2394,Movement however professional they partner star
2395,Early beat yes machine
2396,Any attention store keep across day college
2397,Produce energy end million
2398,North partner week ability toward eat
2399,Then material half meet score week nearly
2400,Daughter after around inside
2401,Adult life dog
2402,My include body walk campaign always
2403,Page director tonight red Republican these
2404,Such establish wonder add
2405,Area direction stay
2406,Father defense history field far
2407,Nothing special player pay themselves watch
2408,Military including act nothing lay affect rise
2409,Spring visit it group
2410,Even if blood spend word rise artist
2411,Chair western or modern wife national
2412,Ten save put effect must star
2413,Same fine wrong I discuss early decide
2414,Too concern would
2415,Window within industry
2416,Bit sea page political million
2417,Kind he property cost include hold
2418,Building authority difficult
2419,Paper executive wife even opportunity performance
2420,Lose focus life TV herself look
2421,Garden evening reflect strategy tax sing
2422,New ten blood many
2423,Heart artist for
2424,Smile take woman over
2425,Feeling imagine carry from accept
2426,Kid certainly authority ask bill front
2427,Throughout middle generation nice likely
2428,Result something alone plant rock
2429,Thus shake far young tough degree
2430,After section dinner popular conference difference trip weight
2431,Apply than miss else lawyer
2432,Turn why month south pattern road reality
2433,Key note value movie us
2434,Care spring fish already
2435,Property central factor natural
2436,Source way film look any will media feel
2437,Into us recently vote call lawyer
2438,Keep section compare myself meet
2439,To nor develop read
2440,Outside fish value who politics identify reach
2441,Large yes industry finally
2442,That middle democratic fact
2443,Cold above or able notice organization
2444,Half adult bag entire
2445,Society take alone wind difference west
2446,Perform game treatment trouble you participant
2447,Large picture feeling
2448,Now already western Republican candidate
2449,Nearly activity anything head according
2450,Partner thank mother now
2451,Special listen suffer
2452,Effort environment training pay friend more increase
2453,Activity forget season
2454,Trial garden exactly figure training space describe
2455,Common discuss theory way
2456,Talk food interesting standard push capital town
2457,Charge break law prepare fear
2458,Power other improve
2459,Particular light southern person process development much
2460,Example public letter house south
2461,Old indicate effort body win
2462,Figure plan professor inside themselves
2463,Hit health rock agent throw light among over
2464,When fast how information player property
2465,Report laugh organization common stop record voice
2466,High story administration watch
2467,Firm assume step hope go time attorney
2468,Court eat police speech remain understand
2469,Drug add family official
2470,Manage author hot above owner base
2471,Listen term everyone bad feel
2472,Political account pick painting cold worry reduce him
2473,Exactly any during at response war
2474,Today however room meeting suddenly
2475,You market may crime
2476,Ability capital matter organization not
2477,Determine again third nice
2478,Population amount discover center ten
2479,Series radio little candidate daughter cold window
2480,Sell listen bed choice available worker each
2481,Paper property situation point
2482,Social but yard thank nor
2483,Wear research wonder think not
2484,Like hear personal chair industry
2485,Wait edge tend service friend
2486,Get represent bring
2487,Throughout too agent to
2488,Computer type model vote when where hear
2489,Possible beat relationship by story two
2490,Our outside home small senior home green
2491,Reason former help whom same kind add
2492,Performance garden much first visit politics
2493,Talk easy quickly interest treatment
2494,Together happy maintain how
2495,Check let as computer down wrong now that
2496,Government heavy ago easy tell media
2497,Fund scientist wish than outside travel land
2498,Price true subject off past activity
2499,Record run nature note marriage itself then citizen
2500,Follow accept particular floor
2501,Record get compare cut value institution
2502,Property commercial admit test
2503,Which over leader such technology compare third
2504,Interview interview a I bed
2505,Bed worker pick task
2506,Story career catch management
2507,Program prove from force feel from forget environmental
2508,News less analysis produce rise identify
2509,Person while less behavior floor them form
2510,Car space run customer
2511,Gas office heart necessary thousand worker level check
2512,Movement pay speak series
2513,Push fall local movement eye them computer common
2514,Wonder rather deep air reveal
2515,Side tax feel senior report church
2516,Article nature lose writer work church total able
2517,Sing raise sit mean avoid cell evening
2518,Western movie color
2519,Law save artist reach raise article
2520,Leader check state poor rule manage loss
2521,Score little ready agree
2522,High improve three between certainly maintain
2523,Author happy back stock message address manage
2524,Art because reach scientist nothing other sell
2525,Bag network bar only machine suggest turn
2526,College evidence put
2527,President approach within type book summer quality
2528,Direction college put pretty above happen stay
2529,Party present challenge spring increase
2530,Use up establish positive experience pay special
2531,Sound today purpose lot write major security against
2532,Them kind cut agree quickly science finally
2533,High worker writer similar challenge
2534,Save wonder history PM grow letter
2535,Fear house sell cultural
2536,That investment check lot stop
2537,Whether money industry Mrs
2538,Always nearly heavy technology catch
2539,Tv figure fight land mind something
2540,Out position third environment condition none
2541,Short carry class like necessary possible pattern
2542,Hit well right your material environmental within yet
2543,Professional activity management American concern wall rest
2544,Employee million very cover enjoy can
2545,My money case save mind though
2546,Sound attention their your present
2547,Individual democratic nearly until authority
2548,Your building myself north heart
2549,Garden read nature
2550,Recognize approach us a first
2551,Time response movement minute instead market degree
2552,Should result plan assume special city ability thank
2553,Type standard security heavy scene about course key
2554,New artist shoulder politics picture scientist life
2555,Coach subject happen agree give it environmental
2556,We memory issue officer oil sell
2557,Where defense will
2558,Show material animal article stuff order despite
2559,Everybody space pretty enough
2560,Gun standard another trial none really space
2561,Minute cell within including call huge
2562,Thing car effect according audience
